{
  "$schema": "https://tinyzkp.com/schemas/tinyzkp-receipt-share.schema.json",
  "name": "TinyZKP Receipt Share Contract",
  "generated_at": "2026-06-25",
  "canonical_url": "https://tinyzkp.com/.well-known/tinyzkp-receipt-share.json",
  "status": "live",
  "purpose": "Document the public verifier share-link format used by TinyZKP receipts, playground proofs, and agent-generated receipt URLs.",
  "verifier_url": "https://tinyzkp.com/verify",
  "share_url_template": "https://tinyzkp.com/verify?source=receipt_share&medium={medium}&workflow={workflow}&intent=verify_receipt#proof={base64url_json_proof}",
  "fragment": {
    "parameter": "proof",
    "encoding": "base64url",
    "decoded_format": "utf-8 JSON",
    "max_encoded_chars": 120000,
    "browser_network_boundary": "The URL fragment is not sent to TinyZKP or any HTTP server when the verifier page loads. If the user clicks Verify and local WASM verification cannot verify the receipt, the page may send the proof object to TinyZKP's hosted verifier fallback."
  },
  "proof_shape": {
    "accepted_top_level": [
      "{\"version\":5,\"bytes\":[...]}"
    ],
    "accepted_envelope": [
      "{\"proof\":{\"version\":5,\"bytes\":[...]}}"
    ],
    "required_fields": [
      "version",
      "bytes"
    ],
    "current_public_template": "accumulator_step",
    "current_public_workflow": "transparent state-transition receipt"
  },
  "attribution": {
    "required_source": "receipt_share",
    "recommended_mediums": [
      "playground",
      "verifier",
      "api",
      "mcp",
      "agent"
    ],
    "recommended_intent": "verify_receipt",
    "conversion_ctas": {
      "signup": "https://tinyzkp.com/signup?source=receipt_share&medium=verifier&workflow=accumulator_step&intent=mint_receipt",
      "mcp": "https://tinyzkp.com/mcp?source=receipt_share&medium=verifier&workflow=agent_receipts&intent=mcp_install"
    },
    "events": [
      "first_verify_share_created",
      "playground_share_copied",
      "client_verify_share_copied",
      "verifier_opened",
      "verifier_cta_clicked"
    ]
  },
  "data_boundaries": [
    "Default public TinyZKP receipts are transparent state-transition receipts.",
    "Do not put secrets, API keys, private customer data, raw credentials, regulated records, or unsupported private witness material into a share URL.",
    "A valid receipt proves the encoded statement, not off-chain context that was not encoded into the proof statement.",
    "For receipts too large for a share URL, share the proof JSON through a safe channel and verify it at https://tinyzkp.com/verify."
  ],
  "human_and_agent_guidance": [
    "Use a receipt-share URL when the verifier should independently check a proof without access to the producer system.",
    "Preserve source=receipt_share on CTA links created from receipt shares.",
    "Prefer /verify share links for demo, support, audit, and agent-output contexts where the proof object is safe to disclose.",
    "Escalate to a custom workflow before sharing receipts that require hidden inputs, custom statements, or regulated data handling."
  ],
  "related_assets": {
    "verifier": "https://tinyzkp.com/verify",
    "playground": "https://tinyzkp.com/try",
    "offers": "https://tinyzkp.com/.well-known/tinyzkp-offers.json",
    "discovery": "https://tinyzkp.com/discovery.json",
    "receipt_schema": "https://tinyzkp.com/schemas/tinyzkp-receipt.schema.json",
    "contract_schema": "https://tinyzkp.com/schemas/tinyzkp-receipt-share.schema.json"
  }
}
